
question,answer
What are the admission requirements?,"You need a high school diploma, a completed application form, and standardized test scores (SAT or ACT)."
What is the application deadline?,The application deadline for the fall semester is January 15.
How much is the tuition fee?,"The annual tuition fee is $20,000 for in-state students and $35,000 for out-of-state students."
What scholarships are available?,We offer merit-based and need-based scholarships. You can apply through the financial aid office.
Where is the library located?,"The library is located at the center of the campus, next to the student union."
What are the library hours?,The library is open from 8 AM to 10 PM on weekdays and 9 AM to 6 PM on weekends.
How can I access online courses?,You can access online courses through the university's learning management system. Log in with your student ID and password.
What majors are offered?,"We offer majors in a variety of fields including Business, Engineering, Computer Science, Arts, and Sciences."
How do I contact academic advising?,You can contact academic advising by emailing advising@college.edu or calling (555) 123-4567.
What are the dormitory options?,"We have several dormitory options including single rooms, double rooms, and suites."
Are meal plans available?,"Yes, we offer several meal plans including vegetarian and vegan options."
How do I join a club or organization?,You can join a club or organization by attending the club fair or contacting the club president directly.
Is there a gym on campus?,"Yes, there is a gym located in the Recreation Center."
What are the gym hours?,The gym is open from 6 AM to 10 PM on weekdays and 8 AM to 8 PM on weekends.
How can I get a parking permit?,You can apply for a parking permit online through the campus parking services website.
What is the campus safety number?,The campus safety number is (555) 987-6543.
How do I request a transcript?,You can request a transcript through the registrar's office website or in person.
Are there any on-campus jobs available?,"Yes, there are various on-campus jobs available for students. You can check the student employment office for listings."
What is the process for changing my major?,You need to meet with your academic advisor to discuss the change and then submit a Change of Major form.
How can I find out about upcoming campus events?,You can find out about upcoming campus events through the university's events calendar on the website or the student union bulletin board.
What are the graduation requirements?,"Graduation requirements include completing all required courses, earning a minimum number of credits, and maintaining a minimum GPA."
How can I get involved in research?,You can get involved in research by contacting faculty members in your department or checking the undergraduate research office for opportunities.
Where can I find mental health services?,Mental health services are available at the campus health center. You can make an appointment by calling (555) 123-7890.
How do I apply for financial aid?,You can apply for financial aid by filling out the FAFSA form and submitting it by the deadline.
What study abroad programs are available?,We offer study abroad programs in various countries. You can find more information through the study abroad office.
How do I register for classes?,You can register for classes online through the student portal during the registration period.
Where can I find the course catalog?,The course catalog is available on the university's website under the academics section.
What are the requirements for joining the honors program?,"The honors program requires a minimum GPA, letters of recommendation, and a personal statement."
How can I get a student ID card?,"You can get a student ID card from the campus ID office, located in the student union."
What transportation options are available on campus?,"Transportation options include campus shuttles, bike rentals, and public transportation passes."
Where can I get help with my resume?,You can get help with your resume at the career services office. They offer workshops and one-on-one advising.
What is the policy on academic integrity?,"Academic integrity policies include prohibitions on cheating, plagiarism, and other forms of academic dishonesty. Detailed policies are available in the student handbook."
Are there any tutoring services available?,"Yes, tutoring services are available through the academic support center."
How do I apply for graduation?,You need to apply for graduation through the registrar's office by the deadline.
What is the process for withdrawing from a class?,You need to submit a withdrawal form to the registrar's office before the withdrawal deadline.
How do I report a maintenance issue in my dorm?,You can report a maintenance issue through the housing portal or by contacting the dorm's front desk.
Where can I find dining options on campus?,"Dining options are available in the student union, various dining halls, and food courts around campus."
What is the policy on class attendance?,Class attendance policies vary by professor and course. Check the syllabus for specific policies.
How can I get a replacement student ID card?,You can get a replacement student ID card at the campus ID office for a fee.
Are there any fitness classes available?,"Yes, fitness classes are available at the gym. Check the gym's schedule for class times."
What is the process for appealing a grade?,"You need to contact your professor to discuss the grade. If necessary, you can submit a formal appeal to the academic department."
Where can I find information about internships?,Internship information is available through the career services office and the student portal.
How can I access the campus Wi-Fi?,You can access the campus Wi-Fi by selecting the university network and logging in with your student credentials.
What resources are available for first-generation college students?,"Resources for first-generation college students include mentoring programs, academic support, and specialized advising."
What is the policy on smoking on campus?,Smoking is prohibited in all campus buildings and within a certain distance from entrances. Designated smoking areas are available.
How do I join an intramural sports team?,You can join an intramural sports team by signing up through the recreation center's website or at the recreation center.
What are the requirements for Dean's List?,"To be on the Dean's List, you must achieve a certain GPA and complete a minimum number of credits in a semester."
How can I get involved in community service?,"You can get involved in community service through the volunteer office, which coordinates various service projects and opportunities."
What is the policy on pets in dorms?,"Pets are not allowed in dorms, except for service animals and emotional support animals with proper documentation."
Where can I find information about graduate programs?,Information about graduate programs is available on the university's website under the graduate studies section.
What is the campus bookstore's return policy?,"The campus bookstore accepts returns within 30 days of purchase with a receipt, as long as the item is in new condition."
How do I sign up for a campus tour?,You can sign up for a campus tour through the admissions office's website.
What is the policy on alcohol on campus?,Alcohol is prohibited in all dormitories and public areas on campus. Students of legal drinking age may consume alcohol in designated areas.
How can I find a study group?,"You can find a study group through your academic department, study center, or student organizations."
Where can I get technical support for my computer?,Technical support is available through the campus IT help desk.
Are there any leadership development programs?,"Yes, leadership development programs are offered through the student affairs office."
How do I file a complaint about a professor?,You can file a complaint about a professor through the academic department or the ombudsman office.
What are the campus health center's hours?,The campus health center is open from 8 AM to 6 PM on weekdays and 9 AM to 3 PM on weekends.
How do I declare a minor?,You can declare a minor by filling out a form and submitting it to your academic advisor.
Are there any study rooms available?,"Yes, study rooms are available in the library and various academic buildings. You can reserve them online."
How do I update my contact information?,You can update your contact information through the student portal.
What is the policy on late assignments?,Late assignment policies vary by professor and course. Check the syllabus for specific policies.
How can I get involved in student government?,"You can get involved in student government by attending meetings, running for a position, or joining a committee."
Where can I find a campus map?,A campus map is available on the university's website and at the information desk in the student union.
How do I apply for on-campus housing?,You can apply for on-campus housing through the housing office's website.
What is the policy on class cancellations?,Class cancellations are communicated through the student portal and email. Check with your professor for specific policies.
"
"
